Reference Name	Text	Font
08b610dc	Aaah! Was willst du?!	[0, 21, 'DINRoundOffcPro']
2015fdcb	Soll sie entscheiden, \n was sie mit dir macht!	[0, 44, 'DINRoundOffcPro']
20c957cb	Bitte schön!	[0, 12, 'DINRoundOffcPro']
21fdf454	Hat er vor, mit ihr \n Schluss zu machen?	[0, 38, 'DINRoundOffcPro']
260de6cb	Ich habe eine Freundin \n gebeten, mich zu einer \n Graveurin zu bringen, \n der ihn dir anfertigt.	[0, 90, 'DINRoundOffcPro']
28a25b6b	Du hast mein Geschäft \n verwüstet!	[0, 32, 'DINRoundOffcPro']
295dffd1	Ich bringe dich jetzt \n zu deiner Freundin.	[0, 41, 'DINRoundOffcPro']
31ea5d71	Tut mir leid, ich komme \n natürlich für die \n Schäden durch meine \n Mitarbeiterin auf.	[0, 80, 'DINRoundOffcPro']
32595cd7	Wo ist die Liebe?!	[0, 18, 'DINRoundOffcPro']
34e8bdbb	Und wie ...	[0, 11, 'DINRoundOffcPro']
3d30c0c1	Bis dann!	[0, 9, 'DINRoundOffcPro']
4325184e	Dass du dich für dein \n Treiben entschuldigst!	[0, 44, 'DINRoundOffcPro']
49494a61	JA! Natürlich \n heirate ich dich!	[0, 31, 'DINRoundOffcPro']
4c6d1a54	Du trampelst auf den \n Gefühlen deiner Freundin \n herum, was hast du \n dazu zu sagen?	[0, 79, 'DINRoundOffcPro']
52914c67	Ich liebe doch nur dich!	[0, 24, 'DINRoundOffcPro']
58244832	Danke, Aki! Bist eine \n tolle Chefin, dich so \n für mich einzusetzen.	[0, 65, 'DINRoundOffcPro']
5bd94e6d	Okay ... Den Ausgang \n hätte ich jetzt nicht \n erwartet ...	[0, 55, 'DINRoundOffcPro']
64215173	Aber Ende gut, \n alles gut?	[0, 25, 'DINRoundOffcPro']
6efc00d3	Vielleicht ist das der \n „geheime Gedanke“ aus \n Pandoras Prophezeiung?	[0, 67, 'DINRoundOffcPro']
74afe1df	Alles nur, um dir einen \n ganz einzigartigen Ring \n zu machen.	[0, 58, 'DINRoundOffcPro']
774403d9	Die arme, arme Frau. \n Das wirst du büßen, \n Betrüger!	[0, 50, 'DINRoundOffcPro']
7df7e3e5	Sie hat mir geholfen, \n das richtige Material \n und all das \n auszusuchen.	[0, 68, 'DINRoundOffcPro']
93934fa4	Dir ist ja klar, dass \n ich dir den Schadener- \n satz vom Gehalt abziehe?	[0, 69, 'DINRoundOffcPro']
964856df	W-Was?!	[0, 7, 'DINRoundOffcPro']
98ebf1ce	Wenn ich daran denke, \n wie sehr diese Frau \n ihn liebt ...	[0, 55, 'DINRoundOffcPro']
9946b629	Bitte schön!	[0, 12, 'DINRoundOffcPro']
9a0f1668	W-Warte, du bist die, \n die mich vorhin am \n Riesenrad gerettet hat.	[0, 64, 'DINRoundOffcPro']
9f9058e5	Komm sofort her, \n du Verbrecherin!	[0, 33, 'DINRoundOffcPro']
a28eb82f	Vielen Dank, du hast uns \n eine große Freude \n gemacht.	[0, 51, 'DINRoundOffcPro']
abd6ba35	Echt super! Spürst du, \n wie die Liebe darin \n förmlich heraussprudelt?	[0, 67, 'DINRoundOffcPro']
af1ee951	Ein Ring?!	[0, 10, 'DINRoundOffcPro']
bb6a5f5d	Was ist das?! Wir sind \n nicht mal im Bild.	[0, 41, 'DINRoundOffcPro']
c03747db	I-I-Ich weiß nicht ...	[0, 22, 'DINRoundOffcPro']
c4b26163	Versuchst du's noch mal?	[0, 24, 'DINRoundOffcPro']
caf6ef63	Ich schwöre dir meine \n unsterbliche Liebe. \n Willst du mich heiraten?	[0, 66, 'DINRoundOffcPro']
cdfa6369	Leute, die die wahre \n Liebe nicht kennen, \n wissen wohl nicht, wie \n man sie einfängt.	[0, 81, 'DINRoundOffcPro']
d0c5d747	Das ist ein großes Miss- \n verständnis, lass mich \n erklären. Sieh mal hier.	[0, 72, 'DINRoundOffcPro']
d35af940	Das ist der eindeutige \n Beweis, dass er \n sie betrügt!	[0, 51, 'DINRoundOffcPro']
d57e1dda	Stell dich nicht dumm, \n Betrüger!	[0, 32, 'DINRoundOffcPro']
d90dda4d	Du hast mich betrogen! \n Ich wusste es.	[0, 37, 'DINRoundOffcPro']
dec61fe0	In flagranti hab ich \n dich erwischt, du kannst \n dich nicht herausreden.	[0, 69, 'DINRoundOffcPro']
e1354bb8	Na gut ... Dann will ich \n die ganze Sache mal \n vergessen.	[0, 55, 'DINRoundOffcPro']
e255dc53	Jetzt bitte sie um \n Verzeihung!	[0, 30, 'DINRoundOffcPro']
e70e22e6	Herumtrampeln? Wovon \n redest du?	[0, 31, 'DINRoundOffcPro']
ea7d4dbe	Für einige gab es ein Happy End. Ich hatte \n nicht so viel Glück – mein kompletter \n Lohn ging für den Schadenersatz drauf.	[0, 119, 'DINRoundOffcPro']
ed3254f9	Hm?	[0, 3, 'DINRoundOffcPro']
f3d5f2c9	Damit ich dir einen \n Antrag machen kann.	[0, 39, 'DINRoundOffcPro']
ff2169d5	Tut mir leid, ihr müsst \n jemand anderen fragen.	[0, 46, 'DINRoundOffcPro']
sm24_00100	Ah! Das ist ...	[0, 15, 'DINRoundOffcPro']
sm24_00100k_010	Er benimmt sich so \n seltsam, ich mache mir \n große Sorgen.	[0, 55, 'DINRoundOffcPro']
sm24_00100k_020	Pandora, schenke uns \n deine Weisheit ...	[0, 39, 'DINRoundOffcPro']
sm24_00100k_030	Pandora hat gesprochen!	[0, 23, 'DINRoundOffcPro']
sm24_00100k_040	Hm? Oh? Ich verstehe!	[0, 21, 'DINRoundOffcPro']
sm24_00100k_050	Er ist umgeben \n von vielen Frauen.	[0, 33, 'DINRoundOffcPro']
sm24_00100k_060	Anderen Frauen?! Sagen \n Sie‘s mir! Wer sind \n diese Ehebrecherinnen?	[0, 65, 'DINRoundOffcPro']
sm24_00100k_070	Ich kann das prüfen, \n aber Privatermittlungen \n kosten extra.	[0, 58, 'DINRoundOffcPro']
sm24_00100k_080	Ich zahle Ihnen, \n was Sie wollen!	[0, 32, 'DINRoundOffcPro']
sm24_00100k_090	Hey, Aki, ich wollte ein \n bisschen plaudern, aber \n du scheinst beschäftigt \n zu sein.	[0, 81, 'DINRoundOffcPro']
sm24_00100k_100	Ah, da kommt ja meine \n Privatdetektivin! Darf \n ich vorstellen? Kat.	[0, 65, 'DINRoundOffcPro']
sm24_00100k_110	Wa– hm?	[0, 7, 'DINRoundOffcPro']
sm24_00100k_120	Kat, kannst du die An- \n gelegenheit dieser Dame \n für mich überprüfen?	[0, 67, 'DINRoundOffcPro']
sm24_00100k_130	Seit wann bin ich deine \n persönliche \n Privatdetektivin?	[0, 53, 'DINRoundOffcPro']
sm24_00100k_140	Und das hier ist ein \n Wahrsagebetrieb, wieso \n übernimmst du überhaupt \n Ermittlungsarbeiten?	[0, 88, 'DINRoundOffcPro']
sm24_00100k_150	Wir fahren jetzt mehr- \n gleisig und kümmern uns \n um die verschiedensten \n Probleme der Menschen.	[0, 92, 'DINRoundOffcPro']
sm24_00100k_160	Bitte, helfen Sie mir! \n Finden Sie raus, wo sich \n mein Freund versteckt.	[0, 70, 'DINRoundOffcPro']
sm24_00100k_170	Er hat gesagt, er wolle \n mich heiraten, aber ich \n weiß nicht, was in \n seinem Kopf vorgeht.	[0, 87, 'DINRoundOffcPro']
sm24_00100k_180	Ich kann weder essen \n noch schlafen. Ich drehe \n noch durch.	[0, 57, 'DINRoundOffcPro']
sm24_00100k_190	Wie soll man da \n Nein sagen ...	[0, 30, 'DINRoundOffcPro']
sm24_00100k_200	Hier ist ein Foto. Er \n konnte immer so \n bezaubernd lächeln.	[0, 57, 'DINRoundOffcPro']
sm24_00100k_210	Und heute ist er \n weggegangen, ohne mir \n zu sagen, wohin er will.	[0, 63, 'DINRoundOffcPro']
sm24_00100k_220	Detektivin Kat, hier \n ist Pandoras \n Prophezeiung.	[0, 47, 'DINRoundOffcPro']
sm24_00100k_230	Sie hilft dir, der Sache \n auf den Grund zu gehen.	[0, 48, 'DINRoundOffcPro']
sm24_00100k_240	Ich bezahle dich pro \n Tag, sobald der Job \n erledigt ist.	[0, 54, 'DINRoundOffcPro']
sm24_00100k_250	O-Okay ...	[0, 10, 'DINRoundOffcPro']
sm24_00100k_260	Ein Tagesgeld, hm. \n Na, dann mal los.	[0, 36, 'DINRoundOffcPro']
sm24_00100k_270	Okay, was besagt denn \n die Prophezeiung ...	[0, 42, 'DINRoundOffcPro']
sm24_00100k_280	„Ein Gesicht sieht herab \n auf die Gier“, „Begeg- \n nung mit einer Göttin“ \n „Geheime Gedanken“.	[0, 90, 'DINRoundOffcPro']
sm24_00100k_290	Die Prophezeiung ergibt \n keinen Sinn ... Manches \n ändert sich wohl nie.	[0, 69, 'DINRoundOffcPro']
sm24_00100k_300	Hm?	[0, 3, 'DINRoundOffcPro']
sm24_00101	Untersuche das „Gesicht“	[0, 24, 'DINRoundOffcPro']
sm24_00102	Ich wusste es, ein Gesicht!	[0, 27, 'DINRoundOffcPro']
sm24_00103	Sieht herab auf die Gier ... Herab ...	[0, 38, 'DINRoundOffcPro']
sm24_00104	Gauner: \n Damit kommst du nicht davon!	[0, 8, 'DINRoundOffcPro'], [8, 36, 'DINRoundOffcPro']
sm24_00105	Hm?	[0, 3, 'DINRoundOffcPro']
sm24_00106	Wollen die für Ärger sorgen?	[0, 28, 'DINRoundOffcPro']
sm24_00107	Verdächtiger Freund: \n Hilfe!	[0, 21, 'DINRoundOffcPro'], [21, 27, 'DINRoundOffcPro']
sm24_00108	Besiege die Gauner	[0, 18, 'DINRoundOffcPro']
sm24_00150k_010	Dieser Smiley auf \n dem Riesenrad ... \n Ich frage mich ...	[0, 54, 'DINRoundOffcPro']
sm24_00150k_020	Das sollte ich mir \n ansehen.	[0, 27, 'DINRoundOffcPro']
sm24_00200k_010	Was hast du zu mir \n gesagt?! Suchst du \n Ärger?	[0, 44, 'DINRoundOffcPro']
sm24_00200k_020	Das war nur so \n dahingesagt, lass ihn \n in Ruhe!	[0, 45, 'DINRoundOffcPro']
sm24_00200k_030	G-Genau, lass uns \n einfach in Ruhe, okay?	[0, 40, 'DINRoundOffcPro']
sm24_00200k_040	Glaubst du, ich nehme \n das einfach so hin?	[0, 41, 'DINRoundOffcPro']
sm24_00200k_050	Ob dieser Typ da in der \n Klemme wohl der Freund \n der Klientin ist?	[0, 64, 'DINRoundOffcPro']
sm24_00200k_060	Hey, äh, Streiten \n gehört sich nicht.	[0, 36, 'DINRoundOffcPro']
sm24_00200k_070	Warum geben wir uns \n nicht alle die Hand und \n alles ist wieder gut?	[0, 65, 'DINRoundOffcPro']
sm24_00200k_080	Für wen hältst du dich \n denn? Ist der Typ ein \n Kumpel von dir?	[0, 60, 'DINRoundOffcPro']
sm24_00200k_090	Nein, ich kenne ihn \n nicht, ich mag bloß \n keinen Streit.	[0, 54, 'DINRoundOffcPro']
sm24_00200k_100	Tja, dein Pech, denn \n hier gibt's jetzt einen!	[0, 45, 'DINRoundOffcPro']
sm24_00200k_110	*seufz* Na, wenn's \n denn sein muss.	[0, 34, 'DINRoundOffcPro']
sm24_00300k_010	Ein Glück, dass du \n aufgetaucht bist!	[0, 36, 'DINRoundOffcPro']
sm24_00300k_020	Süß und stark, was \n für eine Hammer-Kombi!	[0, 41, 'DINRoundOffcPro']
sm24_00300k_030	Worum ging's da \n vorhin?	[0, 23, 'DINRoundOffcPro']
sm24_00300k_040	Ich hab dem Mädchen, das \n bei ihm war, nur gesagt, \n dass sie süß ist.	[0, 67, 'DINRoundOffcPro']
sm24_00300k_050	Harmlos. Aber er ist \n total ausgeflippt!	[0, 39, 'DINRoundOffcPro']
sm24_00300k_060	Hey, darf ich mich mit \n einer Tasse Kaffee \n revanchieren?	[0, 55, 'DINRoundOffcPro']
sm24_00300k_070	Ich weiß, wohin man \n die Ladys ausführt.	[0, 39, 'DINRoundOffcPro']
sm24_00300k_080	Danke, äh, nein, ich \n bin sowieso in Eile.	[0, 41, 'DINRoundOffcPro']
sm24_00300k_090	Oh? Schade. \n Vielleicht nächstes Mal!	[0, 36, 'DINRoundOffcPro']
sm24_00300k_100	Menschenskinder, ist \n das ein Frauenheld!	[0, 40, 'DINRoundOffcPro']
sm24_00500k_010	Brauchen Sie irgendwas?	[0, 23, 'DINRoundOffcPro']
sm24_00500k_020	Eine schöne Kamera hast \n du da. Du machst \n bestimmt tolle \n Fotos.	[0, 62, 'DINRoundOffcPro']
sm24_00500k_030	Würdest du meiner \n Freundin vielleicht \n einen Gefallen tun?	[0, 57, 'DINRoundOffcPro']
sm24_00500k_040	Ja, machst du ein Foto \n von uns? Ach, bitte!	[0, 43, 'DINRoundOffcPro']
sm24_00500k_050	Also, äh, ich hab‘s \n ziemlich eilig ...	[0, 38, 'DINRoundOffcPro']
sm24_00500k_060	Wir sind heute seit drei \n Tagen zusammen! Es ist \n ein besonderer Anlass.	[0, 70, 'DINRoundOffcPro']
sm24_00500k_070	Und es wäre toll, wenn \n ein Profi wie du ein \n Foto davon machen würde.	[0, 68, 'DINRoundOffcPro']
sm24_00500k_080	Ich hab‘s wirklich –	[0, 20, 'DINRoundOffcPro']
sm24_00500k_090	Ach, bitte, bitte, \n bitte! Das wäre \n sooooooooo lieb von dir!	[0, 59, 'DINRoundOffcPro']
sm24_00500k_100	Wenn ich ihnen helfe, \n verliere ich den Kerl \n aus den Augen.	[0, 58, 'DINRoundOffcPro']
sm24_00500k_110	Na gut, ich mach‘s. \n Aber ich beeil mich \n lieber.	[0, 47, 'DINRoundOffcPro']
sm24_00500k_120	Nur ein Foto!	[0, 13, 'DINRoundOffcPro']
sm24_01000	Verdächtiger Freund: \n Hey, bist du nicht das Mädchen von vorhin?	[0, 21, 'DINRoundOffcPro'], [21, 63, 'DINRoundOffcPro']
sm24_01001	Mist, schnell weg!	[0, 18, 'DINRoundOffcPro']
sm24_01002	Ich habe den Freund der Frau verloren!	[0, 38, 'DINRoundOffcPro']
sm24_01003	Verdächtiger Freund: \n Was soll der Lärm?	[0, 21, 'DINRoundOffcPro'], [21, 39, 'DINRoundOffcPro']
sm24_01004	So viel zum Thema „ungesehen verfolgen“.	[0, 40, 'DINRoundOffcPro']
sm24_01005	Puh, das war verdammt knapp.	[0, 28, 'DINRoundOffcPro']
sm24_01006	Folge dem Freund	[0, 16, 'DINRoundOffcPro']
sm24_01007	Ich brauche ein Foto von ihnen.	[0, 31, 'DINRoundOffcPro']
sm24_01008	Schuljunge: \n Heeey! Hier drüben, Fotografin!	[0, 12, 'DINRoundOffcPro'], [12, 43, 'DINRoundOffcPro']
sm24_01009	Schulmädchen: \n Ja, hier drüben sind wir!	[0, 14, 'DINRoundOffcPro'], [14, 39, 'DINRoundOffcPro']
sm24_01010	Pssst, können die nicht leiser sein? Man wird mich noch sehen!	[0, 62, 'DINRoundOffcPro']
sm24_01011	Bring die beiden zum Schweigen	[0, 30, 'DINRoundOffcPro']
sm24_01012	Schuljunge: \n HEY!	[0, 12, 'DINRoundOffcPro'], [12, 16, 'DINRoundOffcPro']
sm24_01013	Schulmädchen: \n Hier drüben!	[0, 14, 'DINRoundOffcPro'], [14, 26, 'DINRoundOffcPro']
sm24_01014	Verdächtiger Freund: \n Bis später!	[0, 21, 'DINRoundOffcPro'], [21, 32, 'DINRoundOffcPro']
sm24_01015	Er betrügt seine Freundin sicher ...	[0, 36, 'DINRoundOffcPro']
sm24_01016	Ich muss sichergehen, dass er nicht sieht, wenn ich ihn verfolge.	[0, 65, 'DINRoundOffcPro']
sm24_01017	Verdächtiger Freund: \n Hm? Ich fühle mich beobachtet.	[0, 21, 'DINRoundOffcPro'], [21, 51, 'DINRoundOffcPro']
sm24_01018	Verdächtiger Freund: \n Hab ich mir wohl nur eingebildet ...	[0, 21, 'DINRoundOffcPro'], [21, 57, 'DINRoundOffcPro']
sm24_01019	Verdächtiger Freund: \n Hat mich jemand gerufen?	[0, 21, 'DINRoundOffcPro'], [21, 45, 'DINRoundOffcPro']
sm24_01020	Verdächtiger Freund: \n Hm, da ist niemand.	[0, 21, 'DINRoundOffcPro'], [21, 40, 'DINRoundOffcPro']
sm24_01021	Verdächtiger Freund: \n Ich könnte schwören, dass ich beobachtet werde!	[0, 21, 'DINRoundOffcPro'], [21, 68, 'DINRoundOffcPro']
sm24_01022	Verdächtiger Freund: \n Ich bin mir sicher, dass ich beobachtet werde ...	[0, 21, 'DINRoundOffcPro'], [21, 70, 'DINRoundOffcPro']
sm24_01023	Ich muss dicht an ihm dranbleiben.	[0, 34, 'DINRoundOffcPro']
sm24_01024	Ich darf ihn nicht aus den Augen verlieren.	[0, 43, 'DINRoundOffcPro']
sm24_01025	Wer ist die Frau?	[0, 17, 'DINRoundOffcPro']
sm24_01026	Ich muss hören, was sie sagen.	[0, 30, 'DINRoundOffcPro']
sm24_01027	Verdächtiger Freund: \n Hey, lange nicht gesehen!	[0, 21, 'DINRoundOffcPro'], [21, 46, 'DINRoundOffcPro']
sm24_01028	Verdächtige Frau: \n Wo willst du hin? Hast du schon was vor?	[0, 18, 'DINRoundOffcPro'], [18, 58, 'DINRoundOffcPro']
sm24_01029	Verdächtiger Freund: \n Tut mir leid, ich hab gerade keine Zeit.	[0, 21, 'DINRoundOffcPro'], [21, 61, 'DINRoundOffcPro']
sm24_01030	Noch eine Frau?	[0, 15, 'DINRoundOffcPro']
sm24_01031	Noch eine verdächtige Frau: \n Bist du noch mit diesem Mädchen zusammen?	[0, 28, 'DINRoundOffcPro'], [28, 69, 'DINRoundOffcPro']
sm24_01032	Verdächtiger Freund: \n Jepp! Danke, dass du uns vorgestellt hast.	[0, 21, 'DINRoundOffcPro'], [21, 63, 'DINRoundOffcPro']
sm24_01033	Hm, sie scheinen befreundet zu sein. Etwas zu sehr ...	[0, 54, 'DINRoundOffcPro']
sm24_01034	Ich sollte vorsichtshalber ein Foto schießen!	[0, 45, 'DINRoundOffcPro']
sm24_01035	Verdächtiger Freund: \n Ich glaube, sie ahnt in letzter Zeit etwas ...	[0, 21, 'DINRoundOffcPro'], [21, 67, 'DINRoundOffcPro']
sm24_01036	Noch eine verdächtige Frau: \n Aber sie hat es nicht herausgefunden, oder?	[0, 28, 'DINRoundOffcPro'], [28, 71, 'DINRoundOffcPro']
sm24_01037	Verdächtiger Freund: \n Ich glaube, ich konnte sie ablenken.	[0, 21, 'DINRoundOffcPro'], [21, 57, 'DINRoundOffcPro']
sm24_01038	Noch eine verdächtige Frau: \n Muss schwer sein, so beliebt zu sein.	[0, 28, 'DINRoundOffcPro'], [28, 65, 'DINRoundOffcPro']
sm24_01039	Und noch eine Frau?	[0, 19, 'DINRoundOffcPro']
sm24_01040	Und noch eine verdächtige Frau: \n Du bist schon so lange nicht mehr vorbeigekommen.	[0, 32, 'DINRoundOffcPro'], [32, 81, 'DINRoundOffcPro']
sm24_01041	Verdächtiger Freund: \n Tut mir leid! Ich muss noch etwas erledigen.	[0, 21, 'DINRoundOffcPro'], [21, 65, 'DINRoundOffcPro']
sm24_01042	Und noch eine verdächtige Frau: \n Lass mich nicht länger warten. Komm endlich vorbei.	[0, 32, 'DINRoundOffcPro'], [32, 83, 'DINRoundOffcPro']
sm24_01043	Ich glaube, er wird rot ...	[0, 27, 'DINRoundOffcPro']
sm24_01044	Ich mache lieber ein Beweisfoto!	[0, 32, 'DINRoundOffcPro']
sm24_01046	Und noch eine verdächtige Frau: \n „Etwas“, hm? Ich glaube, ich weiß, was du brauchst.	[0, 32, 'DINRoundOffcPro'], [32, 83, 'DINRoundOffcPro']
sm24_01047	Verdächtiger Freund: \n Ja, das lässt sich nur schwer ignorieren.	[0, 21, 'DINRoundOffcPro'], [21, 62, 'DINRoundOffcPro']
sm24_01048	Und noch eine verdächtige Frau: \n Das solltest du auch nicht ignorieren.	[0, 32, 'DINRoundOffcPro'], [32, 70, 'DINRoundOffcPro']
sm24_01049	Ach komm schon, nicht noch eine Frau?!	[0, 38, 'DINRoundOffcPro']
sm24_01050	Verdächtiger Freund: \n Hey! Danke für neulich!	[0, 21, 'DINRoundOffcPro'], [21, 44, 'DINRoundOffcPro']
sm24_01051	Nicht noch eine Frau: \n Das war toll! Lass uns das bald wiederholen.	[0, 22, 'DINRoundOffcPro'], [22, 66, 'DINRoundOffcPro']
sm24_01052	Verdächtiger Freund: \n Jederzeit. Ruf mich einfach an!	[0, 21, 'DINRoundOffcPro'], [21, 52, 'DINRoundOffcPro']
sm24_01053	Verdächtiger Freund: \n Oh, übrigens ...	[0, 21, 'DINRoundOffcPro'], [21, 37, 'DINRoundOffcPro']
sm24_01054	Verdächtiger Freund: \n Sag dem anderen Mädchen bitte auch danke von mir.	[0, 21, 'DINRoundOffcPro'], [21, 70, 'DINRoundOffcPro']
sm24_01055	Nicht noch eine Frau: \n Na klar.	[0, 22, 'DINRoundOffcPro'], [22, 30, 'DINRoundOffcPro']
sm24_01056	Verdächtiger Freund: \n Wir sprechen uns später!	[0, 21, 'DINRoundOffcPro'], [21, 45, 'DINRoundOffcPro']
sm24_01057	Das muss die andere Frau sein!	[0, 30, 'DINRoundOffcPro']
sm24_01058	Die mutmaßliche andere Frau: \n Ich habe, worum du mich gebeten hattest.	[0, 29, 'DINRoundOffcPro'], [29, 69, 'DINRoundOffcPro']
sm24_01059	Belausche die Unterhaltung	[0, 26, 'DINRoundOffcPro']
sm24_01060	Verdächtiger Freund: \n Mann, sie wird aus dem Häuschen sein, wenn sie das sieht!	[0, 21, 'DINRoundOffcPro'], [21, 78, 'DINRoundOffcPro']
sm24_01061	Sie hat ihm etwas gegeben ... Aber was?	[0, 39, 'DINRoundOffcPro']
sm24_01062	Ich mache lieber ein Foto.	[0, 26, 'DINRoundOffcPro']
sm24_01063	Nimm ein Beweisfoto auf	[0, 23, 'DINRoundOffcPro']
sm24_01064	Die mutmaßliche andere Frau: \n Das war nicht einfach, bedank dich lieber mal artig.	[0, 29, 'DINRoundOffcPro'], [29, 81, 'DINRoundOffcPro']
sm24_01065	Verdächtiger Freund: \n Du bist einfach wundervoll.	[0, 21, 'DINRoundOffcPro'], [21, 48, 'DINRoundOffcPro']
sm24_01066	Die mutmaßliche andere Frau: \n Gehst du jetzt zu ihr?	[0, 29, 'DINRoundOffcPro'], [29, 51, 'DINRoundOffcPro']
sm24_01067	Verdächtiger Freund: \n Ja, jetzt mache ich Nägel mit Köpfen!	[0, 21, 'DINRoundOffcPro'], [21, 58, 'DINRoundOffcPro']
sm24_01068	Ich muss näher ran, um besser hören zu können.	[0, 46, 'DINRoundOffcPro']
sm24_01069	Ich höre von hier aus nicht genug.	[0, 34, 'DINRoundOffcPro']
sm24_01070	Ich muss näher ran.	[0, 19, 'DINRoundOffcPro']
sm24_01071	Ich brauche ein Beweisfoto.	[0, 27, 'DINRoundOffcPro']
sm24_01072	Woher die beiden sich wohl kennen?	[0, 34, 'DINRoundOffcPro']
sm24_01073	Von wo aus könnte ich das Bild am besten aufnehmen?	[0, 51, 'DINRoundOffcPro']
sm24_01074	Woher die beiden sich wohl kennen?	[0, 34, 'DINRoundOffcPro']
sm24_01075	Sie ist anders als die andere Frau ...	[0, 38, 'DINRoundOffcPro']
sm24_01076	Aber wieso stellt sie ihm andere Frauen vor?	[0, 44, 'DINRoundOffcPro']
sm24_01077	Ich folge ihm lieber noch eine Weile.	[0, 37, 'DINRoundOffcPro']
sm24_01078	Verdächtiger Freund: \n Tut mir leid! Ich komme später vorbei. Versprochen.	[0, 21, 'DINRoundOffcPro'], [21, 72, 'DINRoundOffcPro']
sm24_01079	Hm, sehr suspekt. Aber vielleicht ist sie es nicht.	[0, 51, 'DINRoundOffcPro']
sm24_01080	Ich bleib ihm lieber auf den Fersen.	[0, 36, 'DINRoundOffcPro']
sm24_01081	Puh, hab ich mich erschrocken.	[0, 30, 'DINRoundOffcPro']
sm24_01082	Hm, die auch nicht.	[0, 19, 'DINRoundOffcPro']
sm24_01083	Wo will er eigentlich hin?	[0, 26, 'DINRoundOffcPro']
sm24_01084	Hat sie ihm geholfen, ein Geschenk für eine andere zu besorgen?	[0, 63, 'DINRoundOffcPro']
sm24_01085	Ich hab das Foto!	[0, 17, 'DINRoundOffcPro']
sm24_01086	Aber ihr Gesicht muss zu sehen sein.	[0, 36, 'DINRoundOffcPro']
sm24_01087	Ich war ein bisschen zu nah dran.	[0, 33, 'DINRoundOffcPro']
sm24_01088	Ich bin noch etwas zu weit weg.	[0, 31, 'DINRoundOffcPro']
sm24_01089	Beide müssen auf dem Bild zu sehen sein.	[0, 40, 'DINRoundOffcPro']
sm24_01090	Aber ihr Gesicht muss zu sehen sein.	[0, 36, 'DINRoundOffcPro']
sm24_01091	Man muss hier doch irgendwo ein gutes Foto machen können.	[0, 57, 'DINRoundOffcPro']
sm24_01092	Vielleicht kann ich von dort drüben ein Bild aufnehmen?	[0, 55, 'DINRoundOffcPro']
sm24_01093	Ich könnte versuchen, das Foto von hier aus zu machen.	[0, 54, 'DINRoundOffcPro']
sm24_01094	Verdächtiger Freund: \n Hm?	[0, 21, 'DINRoundOffcPro'], [21, 24, 'DINRoundOffcPro']
sm24_01095	Verdächtiger Freund: \n Hab ich mir wohl nur eingebildet ...	[0, 21, 'DINRoundOffcPro'], [21, 57, 'DINRoundOffcPro']
sm24_01096	Verdächtiger Freund: \n Oh, wow, danke!	[0, 21, 'DINRoundOffcPro'], [21, 36, 'DINRoundOffcPro']
sm24_02000	Das ist nicht der richtige Weg ...	[0, 34, 'DINRoundOffcPro']
sm24_02001	Fotografiere das Paar	[0, 21, 'DINRoundOffcPro']
sm24_02002	Ich muss ein Foto aufnehmen!	[0, 28, 'DINRoundOffcPro']
sm24_02003	Folge dem Freund	[0, 16, 'DINRoundOffcPro']
sm24_02004	Ich glaube, er ist die Treppen runtergelaufen.	[0, 46, 'DINRoundOffcPro']
sm24_02005	Er kann noch nicht weit sein ...	[0, 32, 'DINRoundOffcPro']
sm24_02006	Ist das die „Begegnung mit einer Göttin“ aus der Prophezeiung?	[0, 62, 'DINRoundOffcPro']
sm24_02007	Oh!	[0, 3, 'DINRoundOffcPro']
sm24_02008	Er geht weiter. Ich muss mich beeilen.	[0, 38, 'DINRoundOffcPro']
sm24_02009	Schuljunge: \n Beeil dich und mach das Foto, ja?	[0, 12, 'DINRoundOffcPro'], [12, 45, 'DINRoundOffcPro']
sm24_02010	Wenn die Prophezeiung stimmt, muss er hier irgendwo sein ...	[0, 60, 'DINRoundOffcPro']
sm24_02011	Da drüben ...	[0, 13, 'DINRoundOffcPro']
sm24_02012	Er muss sich dort mit ihr verabredet haben.	[0, 43, 'DINRoundOffcPro']
sm24_02013	Sie sind reingegangen! Ich muss sehen, was passiert.	[0, 52, 'DINRoundOffcPro']
sm24_02014	Nähere dich dem Gebäude \n und decke die Wahrheit auf	[0, 50, 'DINRoundOffcPro']
sm24_02015	Sie sind hier reingegangen ...	[0, 30, 'DINRoundOffcPro']
sm24_02016	Ich kann nichts hören. Vielleicht sind sie im Obergeschoss.	[0, 59, 'DINRoundOffcPro']
sm24_02017	Geh zum Fenster \n im Obergeschoss	[0, 31, 'DINRoundOffcPro']
sm24_02018	Ich glaube, ich höre sie ...	[0, 28, 'DINRoundOffcPro']
sm24_02019	Brich ein	[0, 9, 'DINRoundOffcPro']
sm24_02020	Begleite den Freund \n zu Pandoras Schicksal	[0, 41, 'DINRoundOffcPro']
sm24_02021	Verdächtiger Freund: \n Lass mich runter! Ich bin zu cool, um zu sterben!	[0, 21, 'DINRoundOffcPro'], [21, 70, 'DINRoundOffcPro']
sm24_02022	Verdächtiger Freund: \n Ich habe nichts getan. Du musst mir glauben!	[0, 21, 'DINRoundOffcPro'], [21, 65, 'DINRoundOffcPro']
sm24_02023	Verdächtiger Freund: \n Bitte, ich würde sie nie betrügen.	[0, 21, 'DINRoundOffcPro'], [21, 55, 'DINRoundOffcPro']
sm24_02024	Verdächtiger Freund: \n Ich war ihr immer treu.	[0, 21, 'DINRoundOffcPro'], [21, 44, 'DINRoundOffcPro']
sm24_02025	Verdächtiger Freund: \n Ich konnte nur nicht länger warten ...	[0, 21, 'DINRoundOffcPro'], [21, 59, 'DINRoundOffcPro']
sm24_02026	Verdächtiger Freund: \n Ich will zu Ende bringen, was wir angefangen haben.	[0, 21, 'DINRoundOffcPro'], [21, 72, 'DINRoundOffcPro']
sm24_02027	Sehr verdächtige Frau: \n Dann lass uns loslegen.	[0, 23, 'DINRoundOffcPro'], [23, 46, 'DINRoundOffcPro']
sm24_02028	Loslegen? Womit?	[0, 16, 'DINRoundOffcPro']
sm24_02029	Verdächtiger Freund: \n Ich habe mitgebracht, was du beim letzten Mal wolltest.	[0, 21, 'DINRoundOffcPro'], [21, 76, 'DINRoundOffcPro']
sm24_02030	Verdächtiger Freund: \n Mein Freund hatte einen übrig.	[0, 21, 'DINRoundOffcPro'], [21, 51, 'DINRoundOffcPro']
sm24_02031	Sehr verdächtige Frau: \n Na, dann lass endlich mal sehen.	[0, 23, 'DINRoundOffcPro'], [23, 55, 'DINRoundOffcPro']
sm24_02032	Sehr verdächtige Frau: \n Wie wundervoll, er passt perfekt.	[0, 23, 'DINRoundOffcPro'], [23, 56, 'DINRoundOffcPro']
sm24_02033	Was passt perfekt?	[0, 18, 'DINRoundOffcPro']
sm24_02034	Sehr verdächtige Frau: \n Also ... Hast du dich entschieden?	[0, 23, 'DINRoundOffcPro'], [23, 57, 'DINRoundOffcPro']
sm24_02035	Sehr verdächtige Frau: \n Wirst du es ihr sagen?	[0, 23, 'DINRoundOffcPro'], [23, 45, 'DINRoundOffcPro']
sm24_02036	Verdächtiger Freund: \n Ja, ich gehe direkt zu ihr, wenn wir hier fertig sind.	[0, 21, 'DINRoundOffcPro'], [21, 75, 'DINRoundOffcPro']
sm24_02037	Er will sich von ihr trennen!	[0, 29, 'DINRoundOffcPro']
sm24_02038	Ich muss sehen, was da drin vor sich geht!	[0, 42, 'DINRoundOffcPro']
sm24_02039	Verdächtiges Pärchen: \n AAAGH!	[0, 22, 'DINRoundOffcPro'], [22, 28, 'DINRoundOffcPro']
sm24_02040	Verdächtiger Freund: \n W-Was machst du da?	[0, 21, 'DINRoundOffcPro'], [21, 40, 'DINRoundOffcPro']
sm24_09000	Ich muss herausfinden, was ihr Freund vorhat ...	[0, 48, 'DINRoundOffcPro']
sm24_09001	Alarmstufe	[0, 10, 'DINRoundOffcPro']
