Reference Name	Text	Font
0569c410	Ouvi dizer que o “Anjo \n de luxo” do Aujean é \n perfeito para isso.	[0, 63, 'DINRoundOffcPro']
072c8fd3	...	[0, 3, 'DINRoundOffcPro']
28d37dc9	Os nossos clientes \n desapareceram!	[0, 33, 'DINRoundOffcPro']
3a6382d5	Como se a culpa \n fosse minha...	[0, 30, 'DINRoundOffcPro']
497a6cbf	É para já!	[0, 10, 'DINRoundOffcPro']
6342853b	Nós dissemos-te para \n que não os deixasses ver \n quem tu realmente és.	[0, 67, 'DINRoundOffcPro']
6c8a8741	...	[0, 3, 'DINRoundOffcPro']
75d28947	O vosso gelado nem \n sequer é bom.	[0, 32, 'DINRoundOffcPro']
7e1a8c4d	Não passas de uma \n peste. \n Pisga-te!	[0, 34, 'DINRoundOffcPro']
8760b004	E então!? \n Não te metas onde \n não és chamada!	[0, 43, 'DINRoundOffcPro']
8e7ac796	T-tu tens cá uma lata!	[0, 22, 'DINRoundOffcPro']
97c2c99c	Quem, eu?	[0, 9, 'DINRoundOffcPro']
a8079ffa	Olha lá, estás a \n assustar os outros \n clientes.	[0, 45, 'DINRoundOffcPro']
b14fa1	Ah, vou mostrar-te \n tudo e mais alguma \n coisa!	[0, 44, 'DINRoundOffcPro']
ba97a306	Vá, mostra lá o \n que tens!	[0, 25, 'DINRoundOffcPro']
c0686939	E assim, num só dia, a loja de gelado do Aujean \n teve uma ascensão meteórica até à fama e uma \n queda meteórica até à mediocridade.	[0, 128, 'DINRoundOffcPro']
c1b1ba98	...	[0, 3, 'DINRoundOffcPro']
caf9bc9e	É melhor portarem-se \n bem. \n Promessa de anjo.	[0, 43, 'DINRoundOffcPro']
d0c8a482	Oh pessoal, alguém está \n fingir ser a Kali!	[0, 42, 'DINRoundOffcPro']
d910a788	Quem é que ela \n pensa que é! \n Ela nem é parecida.	[0, 47, 'DINRoundOffcPro']
ecbea872	Bem, vão ter de ouvir \n de outra maneira.	[0, 39, 'DINRoundOffcPro']
f3d8bf04	T-tu?	[0, 5, 'DINRoundOffcPro']
f506ab78	E eles são um perigo \n para os outros clientes.	[0, 45, 'DINRoundOffcPro']
fc20c20a	Nada como um gelado \n para ajudar a resfriar \n uma cabeça quente.	[0, 61, 'DINRoundOffcPro']
fe4ead7e	Isto não vai lá \n com conversa.	[0, 29, 'DINRoundOffcPro']
sm31_00100	Não sei se fico muito confortável a passar pela Kali...	[0, 55, 'DINRoundOffcPro']
sm31_00100k_010	Oh oh, é o Aujean e o \n Eugie. Vou fingir que \n não os vi.	[0, 54, 'DINRoundOffcPro']
sm31_00100k_020	Kat! Ainda bem \n que apareceste!	[0, 30, 'DINRoundOffcPro']
sm31_00100k_030	Experimenta isto, é o \n meu novo produto.	[0, 39, 'DINRoundOffcPro']
sm31_00100k_040	Gelado! E por conta da \n casa? Obrigada.	[0, 38, 'DINRoundOffcPro']
sm31_00100k_050	É bom, hein?	[0, 12, 'DINRoundOffcPro']
sm31_00100k_060	Bem, é aceitável.	[0, 17, 'DINRoundOffcPro']
sm31_00100k_070	Tenho grandes planos \n para a minha banca de \n gelados!	[0, 51, 'DINRoundOffcPro']
sm31_00100k_080	Quero que a minha loja \n seja conhecida em cada \n canto de Hekseville.	[0, 66, 'DINRoundOffcPro']
sm31_00100k_090	Eu sei que o sabor é \n bom mas preciso de \n publicidade.	[0, 52, 'DINRoundOffcPro']
sm31_00100k_100	Queremos que sejas a \n cara da nossa campanha.	[0, 44, 'DINRoundOffcPro']
sm31_00100k_110	Não sei se \n quero...	[0, 19, 'DINRoundOffcPro']
sm31_00100k_120	Então tens de nos \n pagar esse gelado \n que acabaste de comer.	[0, 58, 'DINRoundOffcPro']
sm31_00100k_130	O quê!? Se soubesse... \n Vocês estão à espera que \n eu trabalhe por um cone \n de gelado?	[0, 82, 'DINRoundOffcPro']
sm31_00100k_140	Vá lá, com o teu encanto \n temos tudo para que isto \n corra pelo melhor.	[0, 68, 'DINRoundOffcPro']
sm31_00100k_150	És a única que consegue \n fazer isto!	[0, 35, 'DINRoundOffcPro']
sm31_00100k_160	O Aujean acabou de \n me elogiar?	[0, 30, 'DINRoundOffcPro']
sm31_00100k_170	Então, o que seria \n preciso para fazer \n publicidade à vossa \n banca?	[0, 64, 'DINRoundOffcPro']
sm31_00100k_180	Põe este traje e \n já falamos.	[0, 28, 'DINRoundOffcPro']
sm31_00101	Mas agora não tenho alternativa...	[0, 34, 'DINRoundOffcPro']
sm31_00102	Chama a atenção de 50 pessoas \n e publicita o gelado	[0, 50, 'DINRoundOffcPro']
sm31_00103	Habitante da cidade: \n Eu quero o mesmo que a Kali está a comer!	[0, 21, 'DINRoundOffcPro'], [21, 62, 'DINRoundOffcPro']
sm31_00104	Habitante da cidade: \n Eu também! Eu quero o que ela está a comer.	[0, 21, 'DINRoundOffcPro'], [21, 64, 'DINRoundOffcPro']
sm31_00200k_010	Espera aí… Porque é \n que estou vestido \n como a Kali!?	[0, 51, 'DINRoundOffcPro']
sm31_00200k_020	Já ninguém sabe \n quem é a Rainha \n da Gravidade.	[0, 45, 'DINRoundOffcPro']
sm31_00200k_030	Se não fores famosa, \n não nos serves de \n muito.	[0, 45, 'DINRoundOffcPro']
sm31_00200k_040	Precisamos que vistas \n esse traje e que faças \n publicidade ao novo \n sabor, "Anjo Deluxe".	[0, 86, 'DINRoundOffcPro']
sm31_00200k_050	Prende a atenção das \n pessoas e depois dá \n um espetáculo a \n comeres.	[0, 65, 'DINRoundOffcPro']
sm31_00200k_060	Se as pessoas acharem \n que a Kali gosta vão \n querer experimentar.	[0, 63, 'DINRoundOffcPro']
sm31_00200k_070	Tenta apenas \n manter-te afastada, \n nada de controlar \n a gravidade, ok?	[0, 67, 'DINRoundOffcPro']
sm31_00200k_080	Se acharem que estão \n a ser enganadas, \n estamos tramados.	[0, 55, 'DINRoundOffcPro']
sm31_00200k_083	E não te esqueças, \n o gelado derrete.	[0, 36, 'DINRoundOffcPro']
sm31_00200k_086	Tens de o vender \n antes que vá para \n o lixo.	[0, 42, 'DINRoundOffcPro']
sm31_00200k_090	Ajudar estes dois \n nunca trouxe nada \n de bom…	[0, 43, 'DINRoundOffcPro']
sm31_00300k_010	Então, que tal me saí?	[0, 22, 'DINRoundOffcPro']
sm31_00300k_020	Olha, estás apenas \n a começar, foi assim \n que te saíste.	[0, 54, 'DINRoundOffcPro']
sm31_00300k_030	Vai para um sítio \n com mais pessoas \n da próxima vez!	[0, 50, 'DINRoundOffcPro']
sm31_00300k_040	Tenho de continuar a \n fazer isto?	[0, 32, 'DINRoundOffcPro']
sm31_00300k_050	Precisamos de uma \n fila gigante! Vai lá \n chamar a atenção \n para nós.	[0, 65, 'DINRoundOffcPro']
sm31_00300k_060	Assim que tivermos \n a fila, o resto \n seguir-se-á.	[0, 47, 'DINRoundOffcPro']
sm31_00300k_070	É assim que nasce \n uma tendência.	[0, 32, 'DINRoundOffcPro']
sm31_00300k_080	Suponho que sim...	[0, 18, 'DINRoundOffcPro']
sm31_00400k_010	Kali! Ah, hum, eu \n posso explicar…	[0, 33, 'DINRoundOffcPro']
sm31_00400k_020	Estás a copiar o meu \n estilo? Oh, Rainha da \n Gravidade... \n 	[0, 56, 'DINRoundOffcPro']
sm31_00400k_030	Bem, sabes, tenho um \n trabalho e hum...	[0, 38, 'DINRoundOffcPro']
sm31_00400k_040	O teu trabalho é \n fazeres-te passar por \n mim? Isto está cada \n vez mais interessante.	[0, 81, 'DINRoundOffcPro']
sm31_00400k_050	Mas não tenho tempo \n para isto. Sou a estrela \n principal de um \n espetáculo.	[0, 72, 'DINRoundOffcPro']
sm31_00400k_060	Um espetáculo!? \n Tu tens um \n espetáculo?	[0, 38, 'DINRoundOffcPro']
sm31_00400k_070	Claro, sua tonta. \n Estou sempre a atuar.	[0, 39, 'DINRoundOffcPro']
sm31_00400k_080	Até logo, sua imitadora!	[0, 24, 'DINRoundOffcPro']
sm31_00550k_010	Uau, olha só \n para aquela fila!	[0, 30, 'DINRoundOffcPro']
sm31_00550k_020	Utilizar a Kali para \n publicitar uma banca \n de gelados foi um \n golpe de génio.	[0, 75, 'DINRoundOffcPro']
sm31_00550k_030	O meu génio!	[0, 12, 'DINRoundOffcPro']
sm31_00550k_040	O génio pode ter sido \n teu mas o suor foi meu!	[0, 45, 'DINRoundOffcPro']
sm31_00550k_050	Vocês os dois são-	[0, 18, 'DINRoundOffcPro']
sm31_00550k_060	Que som foi aquele?	[0, 19, 'DINRoundOffcPro']
sm31_00550k_070	Oh, é melhor ires ver! \n Pode ser algo de \n complicado.	[0, 51, 'DINRoundOffcPro']
sm31_00550k_080	Não podemos deixar que \n ninguém nos dê cabo da \n nossa boa sorte.	[0, 62, 'DINRoundOffcPro']
sm31_01000	A seguir é a estação de comboios.	[0, 33, 'DINRoundOffcPro']
sm31_01001	Kali: \n Kat, és tu?	[0, 6, 'DINRoundOffcPro'], [6, 17, 'DINRoundOffcPro']
sm31_01002	Kat imitadora!?	[0, 15, 'DINRoundOffcPro']
sm31_01003	Ah não, isto é tudo culpa do Aujean e do Eugie.	[0, 47, 'DINRoundOffcPro']
sm31_01004	Chama a atenção de 60 pessoas \n e publicita o gelado	[0, 50, 'DINRoundOffcPro']
sm31_02000	Habitante da cidade: \n É a Kali!	[0, 21, 'DINRoundOffcPro'], [21, 30, 'DINRoundOffcPro']
sm31_02001	Habitante da cidade: \n Kali, onde é que vais?	[0, 21, 'DINRoundOffcPro'], [21, 43, 'DINRoundOffcPro']
sm31_02002	Habitante da cidade: \n Aqui, Kali!	[0, 21, 'DINRoundOffcPro'], [21, 32, 'DINRoundOffcPro']
sm31_02003	Tipo com mau aspeto: \n Furaste a fila! Eu estava aqui primeiro.	[0, 21, 'DINRoundOffcPro'], [21, 61, 'DINRoundOffcPro']
sm31_02004	Outro tipo com mau aspeto: \n O quê!? Eu estava aqui muito antes de ti.	[0, 27, 'DINRoundOffcPro'], [27, 68, 'DINRoundOffcPro']
sm31_02005	Tipo com mau aspeto: \n Au! Para com isso!	[0, 21, 'DINRoundOffcPro'], [21, 39, 'DINRoundOffcPro']
sm31_02006	Habitante da cidade: \n Um “Anjo de luxo”!	[0, 21, 'DINRoundOffcPro'], [21, 39, 'DINRoundOffcPro']
sm31_02007	Habitante da cidade: \n Eu também quero um!	[0, 21, 'DINRoundOffcPro'], [21, 40, 'DINRoundOffcPro']
sm31_02008	Habitante da cidade: \n Oh, eu estava primeiro!	[0, 21, 'DINRoundOffcPro'], [21, 44, 'DINRoundOffcPro']
sm31_02011	Resolve o problema dos clientes	[0, 31, 'DINRoundOffcPro']
sm31_02012	E que tal se pararmos de discutir e \n desfrutarmos todos do gelado?	[0, 65, 'DINRoundOffcPro']
sm31_02013	Tenho de acalmar aqueles clientes...	[0, 36, 'DINRoundOffcPro']
sm31_09006	Hum, aqui não está muita gente.	[0, 31, 'DINRoundOffcPro']
sm31_09007	Acho que já consegui a atenção de todos.	[0, 40, 'DINRoundOffcPro']
sm31_09008	Boa! Consegui reunir muitas pessoas.	[0, 36, 'DINRoundOffcPro']
sm31_09009	Clientes	[0, 8, 'DINRoundOffcPro']
sm31_09010	Deteção de fraude	[0, 17, 'DINRoundOffcPro']
sm31_09011	Habitante da cidade: \n Oh, eu acho que aquela não é a Kali.	[0, 21, 'DINRoundOffcPro'], [21, 57, 'DINRoundOffcPro']
sm31_09012	Habitante da cidade: \n É uma impostora!	[0, 21, 'DINRoundOffcPro'], [21, 37, 'DINRoundOffcPro']
sm31_09013	Adoro este Anjo de lu.... Ah, ninguém está a olhar.	[0, 51, 'DINRoundOffcPro']
sm31_09015	Adoro este gelado delicioso!	[0, 28, 'DINRoundOffcPro']
sm31_09016	Não queres ir buscar um e comer comigo?	[0, 39, 'DINRoundOffcPro']
sm31_09017	Eles vendem-no mesmo ali.	[0, 25, 'DINRoundOffcPro']
sm31_09018	Adoro este sabor “Anjo de luxo”!	[0, 32, 'DINRoundOffcPro']
sm31_09019	E adoro todos os que adoram este sabor!	[0, 39, 'DINRoundOffcPro']
sm31_09020	Eles vendem-no mesmo ali.	[0, 25, 'DINRoundOffcPro']
sm31_09021	Tenho de voltar e fazer publicidade à loja de gelados.	[0, 54, 'DINRoundOffcPro']
sm31_09022	Ah, o resto do meu gelado derreteu...	[0, 37, 'DINRoundOffcPro']
sm31_09023	Agente da autoridade: \n Kali, o que estás a fazer aqui?	[0, 22, 'DINRoundOffcPro'], [22, 53, 'DINRoundOffcPro']
sm31_09024	Agente da autoridade: \n Algo não está bem...	[0, 22, 'DINRoundOffcPro'], [22, 42, 'DINRoundOffcPro']
sm31_09025	Agente da autoridade: \n Aquela não é a Kali, pois não?	[0, 22, 'DINRoundOffcPro'], [22, 52, 'DINRoundOffcPro']
sm31_09026	Divulga a loja	[0, 14, 'DINRoundOffcPro']
sm31_09027	Dor de cabeça de gelado, dor de cabeça de gelado!	[0, 49, 'DINRoundOffcPro']
