Reference Name	Text	Font
02a3d0af	Ce qui est important, \n c'est de prévenir les \n gens à propos des \n scarabées.	[0, 72, 'DINRoundOffcPro']
0bebd2b5	Tant qu'il est content \n et qu'il va faire la \n première page...	[0, 60, 'DINRoundOffcPro']
0cd37f85	Dommage. Parfois, \n les choses ne vont pas \n toujours comme on veut.	[0, 64, 'DINRoundOffcPro']
1d7bd7c1	J'ai hâte de lire son \n article, je me demande \n comment le public \n va réagir...	[0, 75, 'DINRoundOffcPro']
7049cb23	Bah, après tout, peu \n importe à qui reviendra \n la gloire.	[0, 55, 'DINRoundOffcPro']
7b1c6a8f	C'est lui qui a gagné \n la récompense.	[0, 36, 'DINRoundOffcPro']
8dac6e9b	Hé, monsieur le \n journaliste ! Comment \n ça s'est fini votre \n histoire de scarabée ?	[0, 80, 'DINRoundOffcPro']
95e4820b	Je suis désolé que tout \n ce travail ait fini à \n la poubelle.	[0, 58, 'DINRoundOffcPro']
b68b7101	J'ai eu droit à \n la première page !	[0, 34, 'DINRoundOffcPro']
bfd37307	J'ai même été nominé \n pour une récompense.	[0, 41, 'DINRoundOffcPro']
e07a62fd	Une récompense ! \n Vous avez gagné ?	[0, 34, 'DINRoundOffcPro']
e9c26403	Eh bien, non... Un autre \n journaliste a pris une \n photo de nous...	[0, 64, 'DINRoundOffcPro']
f20a6709	Il a démontré que tout \n avait été mis en scène, \n et, euh...	[0, 57, 'DINRoundOffcPro']
sm49_00100	S'il veut du "dramatique", je ferais bien de me rapprocher.	[0, 59, 'DINRoundOffcPro']
sm49_00100k_010	Oh, revoilà le fameux \n journaliste !	[0, 35, 'DINRoundOffcPro']
sm49_00100k_020	Hé ! Sur quelle histoire \n vous travaillez cette \n fois-ci ? Un scoop pour \n votre journal ?	[0, 86, 'DINRoundOffcPro']
sm49_00100k_030	En fait... Je ne bosse \n plus pour ce journal.	[0, 44, 'DINRoundOffcPro']
sm49_00100k_040	Tu sais ce que c'est, \n les grandes entreprises. \n J'avais besoin d'un \n nouveau départ.	[0, 82, 'DINRoundOffcPro']
sm49_00100k_050	Alors je suis devenu \n indépendant.	[0, 33, 'DINRoundOffcPro']
sm49_00100k_060	Quand vous parlez de \n "nouveau départ"... \n Vous avez été viré ?	[0, 61, 'DINRoundOffcPro']
sm49_00100k_070	Eh bien, c'est une autre \n manière de la formuler ! \n Mais j'ai bien rebondi.	[0, 73, 'DINRoundOffcPro']
sm49_00100k_080	Mon stylo a soif de \n justice ! Peu importe le \n danger, j'exposerai le \n plus vil des maux.	[0, 86, 'DINRoundOffcPro']
sm49_00100k_090	Bien sûr, bien sûr... \n Et quel est ce mal ?	[0, 42, 'DINRoundOffcPro']
sm49_00100k_100	Les scarabées, pardi !	[0, 22, 'DINRoundOffcPro']
sm49_00100k_110	Cette ville est sous \n la menace des \n scarabées.	[0, 45, 'DINRoundOffcPro']
sm49_00100k_120	J'ai besoin d'une photo \n dramatique des scarabées \n pour montrer le danger \n qu'ils représentent.	[0, 92, 'DINRoundOffcPro']
sm49_00100k_130	Et vous allez risquer \n votre vie pour obtenir \n cette photo.	[0, 57, 'DINRoundOffcPro']
sm49_00100k_140	Oh... Je pensais plutôt \n que ça aurait pu être \n toi qui risques ta vie \n pour l'obtenir.	[0, 84, 'DINRoundOffcPro']
sm49_00100k_150	Mon arme c'est mon \n écriture. Si je me \n blessais à la main...	[0, 59, 'DINRoundOffcPro']
sm49_00100k_160	C'est bizarre, je l'ai \n senti venir dès qu'on a \n commencé à discuter...	[0, 69, 'DINRoundOffcPro']
sm49_00101	Rapproche-toi pour prendre \n une photo du scarabée	[0, 48, 'DINRoundOffcPro']
sm49_00102	Je dois me rapprocher autant que possible...	[0, 44, 'DINRoundOffcPro']
sm49_00103	Il me faut cette photo.	[0, 23, 'DINRoundOffcPro']
sm49_00104	Je ne peux pas laisser un scarabée se promener tranquillement !	[0, 63, 'DINRoundOffcPro']
sm49_00105	Zut, j'avais besoin d'un scarabée pour la photo.	[0, 48, 'DINRoundOffcPro']
sm49_00106	Je vais essayer de m'approcher un peu pour prendre la photo.	[0, 60, 'DINRoundOffcPro']
sm49_00107	Le scarabée n'est pas sur la photo !	[0, 36, 'DINRoundOffcPro']
sm49_00109	Cette photo est parfaite !	[0, 26, 'DINRoundOffcPro']
sm49_00110	Peut-être que je pourrais essayer de le \n prendre en photo sans sa carapace ?	[0, 75, 'DINRoundOffcPro']
sm49_00111	Détruis la carapace du scarabée \n puis prends une photo	[0, 53, 'DINRoundOffcPro']
sm49_00112	Je vais essayer de prendre une photo sous un autre angle.	[0, 57, 'DINRoundOffcPro']
sm49_00113	Prends une photo du scarabée \n sous un angle différent	[0, 52, 'DINRoundOffcPro']
sm49_00117	Je dois m'approcher si je veux prendre une photo "dramatique".	[0, 62, 'DINRoundOffcPro']
sm49_00118	Je suis trop loin, la photo ne sera pas "dramatique".	[0, 53, 'DINRoundOffcPro']
sm49_00119	Je me suis trop rapprochée !	[0, 28, 'DINRoundOffcPro']
sm49_00120	Je dois briser sa carapace...	[0, 29, 'DINRoundOffcPro']
sm49_00121	Il me faut une photo prise depuis un autre angle.	[0, 49, 'DINRoundOffcPro']
sm49_00122	C'est trop dangereux de le laisser seul, \n je ferais mieux de l'éliminer.	[0, 71, 'DINRoundOffcPro']
sm49_00123	Élimine le scarabée	[0, 19, 'DINRoundOffcPro']
sm49_00124	Je ferais bien d'apporter les photos au journaliste.	[0, 52, 'DINRoundOffcPro']
sm49_00125	Retourne voir le journaliste	[0, 28, 'DINRoundOffcPro']
sm49_00126	Prends une photo "dramatique" \n du scarabée	[0, 41, 'DINRoundOffcPro']
sm49_00127	Le scarabée n'est pas sur la photo.	[0, 35, 'DINRoundOffcPro']
sm49_00128	Élimine les scarabées	[0, 21, 'DINRoundOffcPro']
sm49_00200k_010	C'est mon jour de \n chance ! Ce scarabée est \n apparu au bon moment !	[0, 65, 'DINRoundOffcPro']
sm49_00200k_020	Prépare ton appareil \n photo ! Il nous faut \n un beau cliché !	[0, 58, 'DINRoundOffcPro']
sm49_00200k_030	On a effectivement de \n la "chance" qu'il n'y \n ait personne.	[0, 57, 'DINRoundOffcPro']
sm49_00200k_040	Il est temps de prendre \n une photo dramatique \n de ce scarabée.	[0, 60, 'DINRoundOffcPro']
sm49_00200k_050	Oui, assure-toi \n qu'elle soit super \n "dramatique" !	[0, 49, 'DINRoundOffcPro']
sm49_00230k_010	Regardez un peu ça !	[0, 20, 'DINRoundOffcPro']
sm49_00230k_020	Un scarabée ? Un peu \n faiblard pour une photo \n dramatique, non ?	[0, 62, 'DINRoundOffcPro']
sm49_00230k_030	Il n'y avait qu'un seul \n scarabée à prendre en \n photo, vous vous \n attendiez à quoi ?	[0, 81, 'DINRoundOffcPro']
sm49_00230k_040	Si seulement il y en \n avait d'autres, nous \n pourrions prendre une \n excellente photo !	[0, 82, 'DINRoundOffcPro']
sm49_00230k_050	Eh bien, c'est pas le \n cas, alors je suppose \n qu'on va s'arrêter là... \n Quoi ?!	[0, 76, 'DINRoundOffcPro']
sm49_00250k_010	Voilà notre chance ! \n Prends une photo !	[0, 39, 'DINRoundOffcPro']
sm49_00250k_020	Vous croyez pas qu'on \n devrait d'abord les \n empêcher de faire \n des dégâts ?	[0, 72, 'DINRoundOffcPro']
sm49_00250k_030	Prends-les en photo, \n et occupe-toi d'eux \n ensuite !	[0, 50, 'DINRoundOffcPro']
sm49_00250k_040	Allez, ce serait dommage \n de gâcher cette chance \n incroyable, non ?	[0, 65, 'DINRoundOffcPro']
sm49_00300k_010	Mouais... C'est pas \n encore ça.	[0, 30, 'DINRoundOffcPro']
sm49_00300k_020	Pas encore ça ? Quoi, \n c'est pas assez \n dramatique à \n votre goût ?	[0, 63, 'DINRoundOffcPro']
sm49_00300k_030	Pas sans quelqu'un qui \n se retrouve en danger \n pour montrer la menace.	[0, 68, 'DINRoundOffcPro']
sm49_00300k_040	Je ne vais pas rester là \n à prendre des photos si \n jamais quelqu'un a \n besoin d'aide !	[0, 83, 'DINRoundOffcPro']
sm49_00300k_050	Mais c'est pour le bien \n de tous ! Nous devons \n montrer au monde ce \n qu'il se passe.	[0, 81, 'DINRoundOffcPro']
sm49_00300k_060	Vous êtes pas croyable ! \n Et si cette personne se \n retrouvait blessée ?	[0, 69, 'DINRoundOffcPro']
sm49_00300k_070	J'en ai assez, j'arrête.	[0, 24, 'DINRoundOffcPro']
sm49_00300k_080	A-Attends ! A-Aaaargh !	[0, 23, 'DINRoundOffcPro']
sm49_00300k_090	Hein ?!	[0, 7, 'DINRoundOffcPro']
sm49_00400k_010	AAARGH !	[0, 8, 'DINRoundOffcPro']
sm49_00400k_020	Bougez pas, je vais \n m'occuper d'eux.	[0, 36, 'DINRoundOffcPro']
sm49_00400k_030	Non, laisse-moi aux \n pattes des scarabées !	[0, 42, 'DINRoundOffcPro']
sm49_00400k_040	Quoi ?!	[0, 7, 'DINRoundOffcPro']
sm49_00400k_050	Prends une photo de moi \n en train de m'enfuir \n pour sauver ma peau !	[0, 66, 'DINRoundOffcPro']
sm49_00400k_060	Il me faut cette photo, \n coûte que coûte !	[0, 41, 'DINRoundOffcPro']
sm49_00400k_070	Wow, je savais pas qu'il \n avait ça en lui...	[0, 43, 'DINRoundOffcPro']
sm49_00400k_080	Une minute, vous avez \n besoin d'une photo de \n quelqu'un qui se fait \n attaquer, c'est ça ?	[0, 86, 'DINRoundOffcPro']
sm49_00400k_090	Alors pourquoi pas une \n photo de moi qui me \n fais attaquer ?	[0, 58, 'DINRoundOffcPro']
sm49_00400k_100	Dépêchez-vous, allez \n vous cacher !	[0, 34, 'DINRoundOffcPro']
sm49_00400k_110	Ton sacrifice ne sera \n pas vain, je te le \n promets !	[0, 50, 'DINRoundOffcPro']
sm49_00450k_010	J'ai la photo ! Et elle \n est dramatique à \n souhait !	[0, 50, 'DINRoundOffcPro']
sm49_00450k_020	Maintenant, il faut que \n je m'occupe de \n ces Névis.	[0, 49, 'DINRoundOffcPro']
sm49_00500k_010	Quelle horreur ! Quel \n suspense ! Cette photo \n est absolument digne \n d'une première page.	[0, 86, 'DINRoundOffcPro']
sm49_00500k_020	Pendant des années, j'ai \n attendu ma chance.	[0, 43, 'DINRoundOffcPro']
sm49_00500k_030	La première fois, on a \n réussi à étouffer \n l'affaire sur laquelle \n je travaillais.	[0, 79, 'DINRoundOffcPro']
sm49_00500k_040	La deuxième, j'ai \n suivi une fausse piste.	[0, 41, 'DINRoundOffcPro']
sm49_00500k_050	Mais maintenant, c'est \n la bonne. Le monde va \n connaître mon nom !	[0, 64, 'DINRoundOffcPro']
sm49_00500k_060	Euh, je vous ai un peu \n aidé, quand même...	[0, 42, 'DINRoundOffcPro']
sm49_00500k_070	Bien sûr. \n Quelle belle photo, \n n'est-ce pas ?!	[0, 45, 'DINRoundOffcPro']
sm49_00500k_080	Je ne peux pas rester \n là à ne rien faire !	[0, 42, 'DINRoundOffcPro']
sm49_00500k_090	Je dois écrire l'article \n qui accompagnera \n la photo !	[0, 52, 'DINRoundOffcPro']
sm49_00500k_100	Mon nom s'écrit K-A-T, \n d'accord ?	[0, 33, 'DINRoundOffcPro']
sm49_01000	Avec plus d'un scarabée, hein ?	[0, 31, 'DINRoundOffcPro']
sm49_01005	Il faut que j'élimine ces scarabées.	[0, 36, 'DINRoundOffcPro']
sm49_01006	Mince, il n'y en a plus.	[0, 24, 'DINRoundOffcPro']
sm49_01009	Les scarabées ne sont pas sur la photo !	[0, 40, 'DINRoundOffcPro']
sm49_01010	Je suis trop loin, la photo ne sera pas "dramatique".	[0, 53, 'DINRoundOffcPro']
sm49_01011	Je me suis trop rapprochée !	[0, 28, 'DINRoundOffcPro']
sm49_01012	Il n'y a qu'un seul scarabée sur ce cliché.	[0, 43, 'DINRoundOffcPro']
sm49_01014	J'ai eu la photo !	[0, 18, 'DINRoundOffcPro']
sm49_01020	J'ai réussi !	[0, 13, 'DINRoundOffcPro']
sm49_01021	Il n'y a qu'un seul scarabée sur ce cliché.	[0, 43, 'DINRoundOffcPro']
sm49_01022	Il n'y a que deux scarabées sur ce cliché.	[0, 42, 'DINRoundOffcPro']
sm49_01025	C'est trop dangereux de les laisser seuls, \n je ferais mieux de les éliminer.	[0, 75, 'DINRoundOffcPro']
sm49_01027	OK, il est temps de donner ces photos au journaliste.	[0, 53, 'DINRoundOffcPro']
sm49_01029	Prends une photo de 2 scarabées	[0, 31, 'DINRoundOffcPro']
sm49_01030	Il faut que les deux scarabées soient sur la photo...	[0, 53, 'DINRoundOffcPro']
sm49_01031	Je dois prendre une photo de deux scarabées.	[0, 44, 'DINRoundOffcPro']
sm49_01032	Je dois prendre une photo avec quatre scarabées.	[0, 48, 'DINRoundOffcPro']
sm49_01033	Il faut que les deux scarabées soient sur la photo...	[0, 53, 'DINRoundOffcPro']
sm49_01034	Il faut que les quatre scarabées soient sur la photo...	[0, 55, 'DINRoundOffcPro']
sm49_01035	Y en a d'autres qui arrivent, peut-être que je pourrais \n prendre une photo avec quatre dessus ?	[0, 94, 'DINRoundOffcPro']
sm49_01036	Prends une photo de 4 scarabées	[0, 31, 'DINRoundOffcPro']
sm49_01037	Trois à terre, plus qu'un dernier !	[0, 35, 'DINRoundOffcPro']
sm49_01038	Y en a un qui apparaît, mais pas l'autre.	[0, 41, 'DINRoundOffcPro']
sm49_02000	Je pourrais peut-être utiliser le trépied ?	[0, 43, 'DINRoundOffcPro']
sm49_02001	Utilise le trépied pour prendre \n une photo pendant que tu te fais \n attaquer par les scarabées	[0, 91, 'DINRoundOffcPro']
sm49_02002	Je dois prendre une photo des scarabées en train de m'attaquer.	[0, 63, 'DINRoundOffcPro']
sm49_02003	Je dois neutraliser ces scarabées.	[0, 34, 'DINRoundOffcPro']
sm49_02004	Il faut que j'utilise le trépied de mon appareil photo.	[0, 55, 'DINRoundOffcPro']
sm49_02005	Mince, il n'y en a plus.	[0, 24, 'DINRoundOffcPro']
sm49_02006	Les scarabées ne sont pas sur la photo !	[0, 40, 'DINRoundOffcPro']
sm49_02007	Je suis la seule à apparaître sur la photo.	[0, 43, 'DINRoundOffcPro']
sm49_02008	Je suis trop loin, la photo ne sera pas "dramatique".	[0, 53, 'DINRoundOffcPro']
sm49_02009	Je me suis trop rapprochée !	[0, 28, 'DINRoundOffcPro']
sm49_02010	J'ai réussi à prendre la photo !	[0, 32, 'DINRoundOffcPro']
sm49_02011	Les scarabées n'attaquaient pas.	[0, 32, 'DINRoundOffcPro']
sm49_02012	Je ne suis pas sur la photo !	[0, 29, 'DINRoundOffcPro']
sm49_02013	OK, ras-le-bol d'être un punching-ball pour scarabée.	[0, 53, 'DINRoundOffcPro']
sm49_02015	Mission accomplie !	[0, 19, 'DINRoundOffcPro']
sm49_02016	Journaliste : \n Merci !	[0, 14, 'DINRoundOffcPro'], [14, 21, 'DINRoundOffcPro']
sm49_02017	Je les ai eus !	[0, 15, 'DINRoundOffcPro']
sm49_09000	Je crois que je m'éloigne un peu.	[0, 33, 'DINRoundOffcPro']
sm49_09001	Je dois retourner voir le journaliste.	[0, 38, 'DINRoundOffcPro']
